Title,DOI,Abstract,BibTeX
Techniques to assist in developing accessibility engineers,10.1145/1296843.1296865,This paper describes techniques used in a recent computer science course designed to develop accessibility engineers. It provides sufficient detail for other instructors to replicate the highly successful experience that resulted. It also discuses a number of results of the course that act as indicators of its success.,"{'series': ""Assets '07"", 'location': 'Tempe, Arizona, USA', 'keywords': 'accessibility, assistive technology, universal access, universal access reference model, usability, user-system model', 'numpages': '8', 'pages': '123–130', 'booktitle': 'Proceedings of the 9th International ACM SIGACCESS Conference on Computers and Accessibility', 'abstract': 'This paper describes techniques used in a recent computer science course designed to develop accessibility engineers. It provides sufficient detail for other instructors to replicate the highly successful experience that resulted. It also discuses a number of results of the course that act as indicators of its success.', 'doi': '10.1145/1296843.1296865', 'url': 'https://doi.org/10.1145/1296843.1296865', 'address': 'New York, NY, USA', 'publisher': 'Association for Computing Machinery', 'isbn': '9781595935731', 'year': '2007', 'title': 'Techniques to assist in developing accessibility engineers', 'author': 'Carter, Jim A. and Fourney, David W.', 'ENTRYTYPE': 'inproceedings', 'ID': '10.1145/1296843.1296865'}"
Session details: Older and younger,10.1145/3245828,Abstract not available,"{'series': ""Assets '07"", 'location': 'Tempe, Arizona, USA', 'booktitle': 'Proceedings of the 9th International ACM SIGACCESS Conference on Computers and Accessibility', 'doi': '10.1145/3245828', 'url': 'https://doi.org/10.1145/3245828', 'address': 'New York, NY, USA', 'publisher': 'Association for Computing Machinery', 'isbn': '9781595935731', 'year': '2007', 'title': 'Session details: Older and younger', 'author': 'Yesilada, Yeliz', 'ENTRYTYPE': 'inproceedings', 'ID': '10.1145/3245828'}"
Providing good memory cues for people with episodic memory impairment,10.1145/1296843.1296867,"Alzheimer's disease impairs episodic memory and subtly and progressively robs people of their ability to remember their recent experiences. In this paper, we describe two studies that lead to a better understanding of how caregivers use cues to support episodic memory impairment and what types of cues are best for supporting recollection. We also show how good memory cues differ between people with and without episodic memory impairment. We discuss how this improved understanding impacts the design of lifelogging technologies for automatically capturing and extracting the best memory cues to assist overburdened caregivers and people with episodic memory impairment in supporting recollection of episodic memory.","{'series': ""Assets '07"", 'location': 'Tempe, Arizona, USA', 'keywords': ""alzheimer's disease, caregiver burden, cues, elders, episodic memory"", 'numpages': '8', 'pages': '131–138', 'booktitle': 'Proceedings of the 9th International ACM SIGACCESS Conference on Computers and Accessibility', 'abstract': ""Alzheimer's disease impairs episodic memory and subtly and progressively robs people of their ability to remember their recent experiences. In this paper, we describe two studies that lead to a better understanding of how caregivers use cues to support episodic memory impairment and what types of cues are best for supporting recollection. We also show how good memory cues differ between people with and without episodic memory impairment. We discuss how this improved understanding impacts the design of lifelogging technologies for automatically capturing and extracting the best memory cues to assist overburdened caregivers and people with episodic memory impairment in supporting recollection of episodic memory."", 'doi': '10.1145/1296843.1296867', 'url': 'https://doi.org/10.1145/1296843.1296867', 'address': 'New York, NY, USA', 'publisher': 'Association for Computing Machinery', 'isbn': '9781595935731', 'year': '2007', 'title': 'Providing good memory cues for people with episodic memory impairment', 'author': 'Lee, Matthew L. and Dey, Anind K.', 'ENTRYTYPE': 'inproceedings', 'ID': '10.1145/1296843.1296867'}"
Data visualisation and data mining technology for supporting care for older people,10.1145/1296843.1296868,"The overall purpose of the research discussed here is the enhancement of home-based care by revealing individual patterns in the life of a person, through modelling of the ""busyness"" of activity in their dwelling, so that care can be better tailored to their needs and changing circumstances. The use of data mining and on-line analytical processing (OLAP) is potentially interesting in this context because of the possibility of exploring, detecting and predicting changes in the level of activity of people's movement that may reflect change in well-being. An investigation is presented here into the use of data mining and visualisation to illustrate activity from sensor data from a trial project run in a domestic context.","{'series': ""Assets '07"", 'location': 'Tempe, Arizona, USA', 'keywords': 'assistive technology, data mining, independent living, older adults, visualisation', 'numpages': '8', 'pages': '139–146', 'booktitle': 'Proceedings of the 9th International ACM SIGACCESS Conference on Computers and Accessibility', 'abstract': 'The overall purpose of the research discussed here is the enhancement of home-based care by revealing individual patterns in the life of a person, through modelling of the ""busyness"" of activity in their dwelling, so that care can be better tailored to their needs and changing circumstances. The use of data mining and on-line analytical processing (OLAP) is potentially interesting in this context because of the possibility of exploring, detecting and predicting changes in the level of activity of people\'s movement that may reflect change in well-being. An investigation is presented here into the use of data mining and visualisation to illustrate activity from sensor data from a trial project run in a domestic context.', 'doi': '10.1145/1296843.1296868', 'url': 'https://doi.org/10.1145/1296843.1296868', 'address': 'New York, NY, USA', 'publisher': 'Association for Computing Machinery', 'isbn': '9781595935731', 'year': '2007', 'title': 'Data visualisation and data mining technology for supporting care for older people', 'author': 'Gil, Nubia M. and Hine, Nicolas A. and Arnott, John L. and Hanson, Julienne and Curry, Richard G. and Amaral, Telmo and Osipovic, Dorota', 'ENTRYTYPE': 'inproceedings', 'ID': '10.1145/1296843.1296868'}"
An operantly conditioned looking task for assessing infant auditory processing ability,10.1145/1296843.1296869,"In this paper, we describe the design and evaluation of a gaze-driven interface for the assessment of rapid auditory processing abilities in infants aged 4 to 6 months. A cross-modal operant conditioning procedure is used to reinforce anticipatory eye movements in response to changes in a continuous auditory stream. Using this procedure, we hope to develop a clinical tool that will enable early identification of individuals at risk for language-based learning impairments. Some of the unique opportunities and challenges inherent to designing for infant-computer interaction are discussed.","{'series': ""Assets '07"", 'location': 'Tempe, Arizona, USA', 'keywords': 'early assessment, eye tracking, infant-computer interaction, language impairment, operant conditioning', 'numpages': '8', 'pages': '147–154', 'booktitle': 'Proceedings of the 9th International ACM SIGACCESS Conference on Computers and Accessibility', 'abstract': 'In this paper, we describe the design and evaluation of a gaze-driven interface for the assessment of rapid auditory processing abilities in infants aged 4 to 6 months. A cross-modal operant conditioning procedure is used to reinforce anticipatory eye movements in response to changes in a continuous auditory stream. Using this procedure, we hope to develop a clinical tool that will enable early identification of individuals at risk for language-based learning impairments. Some of the unique opportunities and challenges inherent to designing for infant-computer interaction are discussed.', 'doi': '10.1145/1296843.1296869', 'url': 'https://doi.org/10.1145/1296843.1296869', 'address': 'New York, NY, USA', 'publisher': 'Association for Computing Machinery', 'isbn': '9781595935731', 'year': '2007', 'title': 'An operantly conditioned looking task for assessing infant auditory processing ability', 'author': 'Nawyn, Jason and Roesler, Cynthia and Realpe-Bonilla, Teresa and Choudhury, Naseem and Benasich, April A.', 'ENTRYTYPE': 'inproceedings', 'ID': '10.1145/1296843.1296869'}"
Session details: Personal technologies,10.1145/3245829,Abstract not available,"{'series': ""Assets '07"", 'location': 'Tempe, Arizona, USA', 'booktitle': 'Proceedings of the 9th International ACM SIGACCESS Conference on Computers and Accessibility', 'doi': '10.1145/3245829', 'url': 'https://doi.org/10.1145/3245829', 'address': 'New York, NY, USA', 'publisher': 'Association for Computing Machinery', 'isbn': '9781595935731', 'year': '2007', 'title': 'Session details: Personal technologies', 'author': 'Feng, Jinjuan', 'ENTRYTYPE': 'inproceedings', 'ID': '10.1145/3245829'}"
"Using participatory activities with seniors to critique, build, and evaluate mobile phones",10.1145/1296843.1296871,"Mobile phones can provide a number of benefits to older people. However, most mobile phone designs and form factors are targeted at younger people and middle-aged adults. To inform the design of mobile phones for seniors, we ran several participatory activities where seniors critiqued current mobile phones, chose important applications, and built their own imagined mobile phone system. We prototyped this system on a real mobile phone and evaluated the seniors' performance through user tests and a real-world deployment. We found that our participants wanted more than simple phone functions, and instead wanted a variety of application areas. While they were able to learn to use the software with little difficulty, hardware design made completing some tasks frustrating or difficult. Based on our experience with our participants, we offer considerations for the community about how to design mobile devices for seniors and how to engage them in participatory activities.","{'series': ""Assets '07"", 'location': 'Tempe, Arizona, USA', 'keywords': 'accessibility, elderly, guidelines, mobile devices, mobile phones, participatory design, scenarios, seniors, usability', 'numpages': '8', 'pages': '155–162', 'booktitle': 'Proceedings of the 9th International ACM SIGACCESS Conference on Computers and Accessibility', 'abstract': ""Mobile phones can provide a number of benefits to older people. However, most mobile phone designs and form factors are targeted at younger people and middle-aged adults. To inform the design of mobile phones for seniors, we ran several participatory activities where seniors critiqued current mobile phones, chose important applications, and built their own imagined mobile phone system. We prototyped this system on a real mobile phone and evaluated the seniors' performance through user tests and a real-world deployment. We found that our participants wanted more than simple phone functions, and instead wanted a variety of application areas. While they were able to learn to use the software with little difficulty, hardware design made completing some tasks frustrating or difficult. Based on our experience with our participants, we offer considerations for the community about how to design mobile devices for seniors and how to engage them in participatory activities."", 'doi': '10.1145/1296843.1296871', 'url': 'https://doi.org/10.1145/1296843.1296871', 'address': 'New York, NY, USA', 'publisher': 'Association for Computing Machinery', 'isbn': '9781595935731', 'year': '2007', 'title': 'Using participatory activities with seniors to critique, build, and evaluate mobile phones', 'author': 'Massimi, Michael and Baecker, Ronald M. and Wu, Michael', 'ENTRYTYPE': 'inproceedings', 'ID': '10.1145/1296843.1296871'}"
Variable frame rate for low power mobile sign language communication,10.1145/1296843.1296872,"The MobileASL project aims to increase accessibility by enabling Deaf people to communicate over video cell phones in their native language, American Sign Language (ASL). Real-time video over cell phones can be a computationally intensive task that quickly drains the battery, rendering the cell phone useless. Properties of conversational sign language allow us to save power and bits: namely, lower frame rates are possible when one person is not signing due to turn-taking, and signing can potentially employ a lower frame rate than fingerspelling. We conduct a user study with native signers to examine the intelligibility of varying the frame rate based on activity in the video. We then describe several methods for automatically determining the activity of signing or not signing from the video stream in real-time. Our results show that varying the frame rate during turn-taking is a good way to save power without sacrificing intelligibility, and that automatic activity analysis is feasible.","{'series': ""Assets '07"", 'location': 'Tempe, Arizona, USA', 'keywords': 'activity analysis, deaf community, low power, mobile telephone use, sign language', 'numpages': '8', 'pages': '163–170', 'booktitle': 'Proceedings of the 9th International ACM SIGACCESS Conference on Computers and Accessibility', 'abstract': 'The MobileASL project aims to increase accessibility by enabling Deaf people to communicate over video cell phones in their native language, American Sign Language (ASL). Real-time video over cell phones can be a computationally intensive task that quickly drains the battery, rendering the cell phone useless. Properties of conversational sign language allow us to save power and bits: namely, lower frame rates are possible when one person is not signing due to turn-taking, and signing can potentially employ a lower frame rate than fingerspelling. We conduct a user study with native signers to examine the intelligibility of varying the frame rate based on activity in the video. We then describe several methods for automatically determining the activity of signing or not signing from the video stream in real-time. Our results show that varying the frame rate during turn-taking is a good way to save power without sacrificing intelligibility, and that automatic activity analysis is feasible.', 'doi': '10.1145/1296843.1296872', 'url': 'https://doi.org/10.1145/1296843.1296872', 'address': 'New York, NY, USA', 'publisher': 'Association for Computing Machinery', 'isbn': '9781595935731', 'year': '2007', 'title': 'Variable frame rate for low power mobile sign language communication', 'author': 'Cherniavsky, Neva and Cavender, Anna C. and Ladner, Richard E. and Riskin, Eve A.', 'ENTRYTYPE': 'inproceedings', 'ID': '10.1145/1296843.1296872'}"
Observing Sara: a case study of a blind person's interactions with technology,10.1145/1296843.1296873,"While software is increasingly being improved to enhance access and use, software interfaces nonetheless often create barriers for people who are blind. In response, the blind computer user develops workarounds, strategies to overcome the constraints of a physical and social world engineered for the sighted. This paper describes an interview and observational study of a blind college student interacting with various technologies within her home. Structured around Blythe, Monk and Park's Technology Biographies, these experience centered sessions focus not only on technology function, but on the relationship of function to the meanings and values that this student attributes to technology use in different settings. Studying a single user across a range of devices and tasks provides a broader and more nuanced understanding of the contexts and causes of task failure and of the workarounds employed than is possible with a more narrowly focused usability study. Themes that were revealed across a range of tasks include the importance for technologies to not ""mark"" the user as being blind within a predominantly sighted social world, to support user independence through portability and user control, and to allow user ""resets"" and brute-force fallbacks in the face of persistent task failure.","{'series': ""Assets '07"", 'location': 'Tempe, Arizona, USA', 'keywords': 'assistive technology, technology biographies, user-centered inclusive design', 'numpages': '8', 'pages': '171–178', 'booktitle': 'Proceedings of the 9th International ACM SIGACCESS Conference on Computers and Accessibility', 'abstract': 'While software is increasingly being improved to enhance access and use, software interfaces nonetheless often create barriers for people who are blind. In response, the blind computer user develops workarounds, strategies to overcome the constraints of a physical and social world engineered for the sighted. This paper describes an interview and observational study of a blind college student interacting with various technologies within her home. Structured around Blythe, Monk and Park\'s Technology Biographies, these experience centered sessions focus not only on technology function, but on the relationship of function to the meanings and values that this student attributes to technology use in different settings. Studying a single user across a range of devices and tasks provides a broader and more nuanced understanding of the contexts and causes of task failure and of the workarounds employed than is possible with a more narrowly focused usability study. Themes that were revealed across a range of tasks include the importance for technologies to not ""mark"" the user as being blind within a predominantly sighted social world, to support user independence through portability and user control, and to allow user ""resets"" and brute-force fallbacks in the face of persistent task failure.', 'doi': '10.1145/1296843.1296873', 'url': 'https://doi.org/10.1145/1296843.1296873', 'address': 'New York, NY, USA', 'publisher': 'Association for Computing Machinery', 'isbn': '9781595935731', 'year': '2007', 'title': ""Observing Sara: a case study of a blind person's interactions with technology"", 'author': 'Shinohara, Kristen and Tenenberg, Josh', 'ENTRYTYPE': 'inproceedings', 'ID': '10.1145/1296843.1296873'}"
Understanding mobile phone requirements for young adults with cognitive disabilities,10.1145/1296843.1296874,"Mobile phones have transformed the way we communicate with friends and family, coordinate our daily activities, and organize our lives. For families with children with cognitive disabilities there is widespread hope, though not always fulfilled, that personal technologies - particularly mobile phones - can bring a dramatic increase in their children's level of safety, independence, and social connectedness. In this research, we conducted semi-structured interviews with five families to understand the current patterns of remote communication among young adults with cognitive disabilities and their parental caregivers, and the role that remote communication played in increasing independence and safety. While some of the young adults used mobile phones and some did not, we identified common themes in requirements, patterns of use, and desires for an accessible mobile-phone based remote communication system. Requirements include the need for a simplified navigation menu with fewer options and a rugged handset and charger input. Families used mobile phones for safety check-ins and help getting un-stuck. While parents desired increased social involvement for their children, they observed that their children did not often chat with friends on the phone.","{'series': ""Assets '07"", 'location': 'Tempe, Arizona, USA', 'keywords': 'assistive technology, cognitive disabilities, design requirements, ethnography, mobile phones, semi-structured interviews', 'numpages': '8', 'pages': '179–186', 'booktitle': 'Proceedings of the 9th International ACM SIGACCESS Conference on Computers and Accessibility', 'abstract': ""Mobile phones have transformed the way we communicate with friends and family, coordinate our daily activities, and organize our lives. For families with children with cognitive disabilities there is widespread hope, though not always fulfilled, that personal technologies - particularly mobile phones - can bring a dramatic increase in their children's level of safety, independence, and social connectedness. In this research, we conducted semi-structured interviews with five families to understand the current patterns of remote communication among young adults with cognitive disabilities and their parental caregivers, and the role that remote communication played in increasing independence and safety. While some of the young adults used mobile phones and some did not, we identified common themes in requirements, patterns of use, and desires for an accessible mobile-phone based remote communication system. Requirements include the need for a simplified navigation menu with fewer options and a rugged handset and charger input. Families used mobile phones for safety check-ins and help getting un-stuck. While parents desired increased social involvement for their children, they observed that their children did not often chat with friends on the phone."", 'doi': '10.1145/1296843.1296874', 'url': 'https://doi.org/10.1145/1296843.1296874', 'address': 'New York, NY, USA', 'publisher': 'Association for Computing Machinery', 'isbn': '9781595935731', 'year': '2007', 'title': 'Understanding mobile phone requirements for young adults with cognitive disabilities', 'author': 'Dawe, Melissa', 'ENTRYTYPE': 'inproceedings', 'ID': '10.1145/1296843.1296874'}"
Session details: Supporting communication,10.1145/3245830,Abstract not available,"{'series': ""Assets '07"", 'location': 'Tempe, Arizona, USA', 'booktitle': 'Proceedings of the 9th International ACM SIGACCESS Conference on Computers and Accessibility', 'doi': '10.1145/3245830', 'url': 'https://doi.org/10.1145/3245830', 'address': 'New York, NY, USA', 'publisher': 'Association for Computing Machinery', 'isbn': '9781595935731', 'year': '2007', 'title': 'Session details: Supporting communication', 'author': 'Hanson, Vicki', 'ENTRYTYPE': 'inproceedings', 'ID': '10.1145/3245830'}"
The design and field evaluation of PhotoTalk: a digital image communication application for people,10.1145/1296843.1296876,"Talk is an application for a mobile device that allows people with aphasia to capture and manage digital photographs to support face-to-face communication. Unlike any other augmentative and alternative communication device for people with aphasia, PhotoTalk focuses solely on image capture and organization and is designed to be used independently. Our project used a streamlined process with 3 phases: (1) a rapid participatory design and development phase with two speech-language pathologists acting as representative users, (2) an informal usability study with 5 aphasic participants, which caught usability problems and provided preliminary feedback on the usefulness of PhotoTalk, and (3) a 1 month field evaluation with 2 aphasic participants, which showed that both used it regularly and fairly independently, although not always for its intended communicative purpose. Our field study demonstrated PhotoTalk's promise in terms of its usability and usefulness in real life situations.","{'series': ""Assets '07"", 'location': 'Tempe, Arizona, USA', 'keywords': 'AAC devices, aphasia, cognitive disability, evaluation, field study, mobile technology, participatory design', 'numpages': '8', 'pages': '187–194', 'booktitle': 'Proceedings of the 9th International ACM SIGACCESS Conference on Computers and Accessibility', 'abstract': ""Talk is an application for a mobile device that allows people with aphasia to capture and manage digital photographs to support face-to-face communication. Unlike any other augmentative and alternative communication device for people with aphasia, PhotoTalk focuses solely on image capture and organization and is designed to be used independently. Our project used a streamlined process with 3 phases: (1) a rapid participatory design and development phase with two speech-language pathologists acting as representative users, (2) an informal usability study with 5 aphasic participants, which caught usability problems and provided preliminary feedback on the usefulness of PhotoTalk, and (3) a 1 month field evaluation with 2 aphasic participants, which showed that both used it regularly and fairly independently, although not always for its intended communicative purpose. Our field study demonstrated PhotoTalk's promise in terms of its usability and usefulness in real life situations."", 'doi': '10.1145/1296843.1296876', 'url': 'https://doi.org/10.1145/1296843.1296876', 'address': 'New York, NY, USA', 'publisher': 'Association for Computing Machinery', 'isbn': '9781595935731', 'year': '2007', 'title': 'The design and field evaluation of PhotoTalk: a digital image communication application for people', 'author': 'Allen, Meghan and McGrenere, Joanna and Purves, Barbara', 'ENTRYTYPE': 'inproceedings', 'ID': '10.1145/1296843.1296876'}"
