Title,DOI,Abstract,BibTeX
Misfitting With AI: How Blind People Verify and Contest AI Errors,10.1145/3663548.3675659,"Blind people use artificial intelligence-enabled visual assistance technologies (AI VAT) to gain visual access in their everyday lives, but these technologies are embedded with errors that may be difficult to verify non-visually. Previous studies have primarily explored sighted users’ understanding of AI output and created vision-dependent explainable AI (XAI) features. We extend this body of literature by conducting an in-depth qualitative study with 26 blind people to understand their verification experiences and preferences. We begin by describing errors blind people encounter, highlighting how AI VAT fails to support complex document layouts, diverse languages, and cultural artifacts. We then illuminate how blind people make sense of AI through experimenting with AI VAT, employing non-visual skills, strategically including sighted people, and cross-referencing with other devices. Participants provided detailed opportunities for designing accessible XAI, such as affordances to support contestation. Informed by disability studies framework of misfitting and fitting, we unpacked harmful assumptions with AI VAT, underscoring the importance of celebrating disabled ways of knowing. Lastly, we offer practical takeaways for Responsible AI practice to push the field of accessible XAI forward.","{'series': ""ASSETS '24"", 'location': ""St. John's, NL, Canada"", 'keywords': 'Accessibility, Artificial Intelligence, Be My Eyes, Blind people, Explainability, Seeing AI, Verification, Visual Assistance Technology', 'numpages': '17', 'articleno': '61', 'booktitle': 'Proceedings of the 26th International ACM SIGACCESS Conference on Computers and Accessibility', 'abstract': 'Blind people use artificial intelligence-enabled visual assistance technologies (AI VAT) to gain visual access in their everyday lives, but these technologies are embedded with errors that may be difficult to verify non-visually. Previous studies have primarily explored sighted users’ understanding of AI output and created vision-dependent explainable AI (XAI) features. We extend this body of literature by conducting an in-depth qualitative study with 26 blind people to understand their verification experiences and preferences. We begin by describing errors blind people encounter, highlighting how AI VAT fails to support complex document layouts, diverse languages, and cultural artifacts. We then illuminate how blind people make sense of AI through experimenting with AI VAT, employing non-visual skills, strategically including sighted people, and cross-referencing with other devices. Participants provided detailed opportunities for designing accessible XAI, such as affordances to support contestation. Informed by disability studies framework of misfitting and fitting, we unpacked harmful assumptions with AI VAT, underscoring the importance of celebrating disabled ways of knowing. Lastly, we offer practical takeaways for Responsible AI practice to push the field of accessible XAI forward.', 'doi': '10.1145/3663548.3675659', 'url': 'https://doi.org/10.1145/3663548.3675659', 'address': 'New York, NY, USA', 'publisher': 'Association for Computing Machinery', 'isbn': '9798400706776', 'year': '2024', 'title': 'Misfitting With AI: How Blind People Verify and Contest AI Errors', 'author': 'Alharbi, Rahaf and Lor, Pa and Herskovitz, Jaylin and Schoenebeck, Sarita and Brewer, Robin N.', 'ENTRYTYPE': 'inproceedings', 'ID': '10.1145/3663548.3675659'}"
Context-Aware Image Descriptions for Web Accessibility,10.1145/3663548.3675658,"Blind and low vision (BLV) internet users access images on the web via text descriptions. New vision-to-language models such as GPT-V, Gemini, and LLaVa can now provide detailed image descriptions on-demand. While prior research and guidelines state that BLV audiences’ information preferences depend on the context of the image, existing tools for accessing vision-to-language models provide only context-free image descriptions by generating descriptions for the image alone without considering the surrounding webpage context. To explore how to integrate image context into image descriptions, we designed a Chrome Extension that automatically extracts webpage context to inform GPT-4V-generated image descriptions. We gained feedback from 12 BLV participants in a user study comparing typical context-free image descriptions to context-aware image descriptions. We then further evaluated our context-informed image descriptions with a technical evaluation. Our user evaluation demonstrates that BLV participants frequently prefer context-aware descriptions to context-free descriptions. BLV participants also rate context-aware descriptions significantly higher in quality, imaginability, relevance, and plausibility. All participants shared that they wanted to use context-aware descriptions in the future and highlighted the potential for use in online shopping, social media, news, and personal interest blogs.","{'series': ""ASSETS '24"", 'location': ""St. John's, NL, Canada"", 'keywords': 'Accessibility, Context Awareness, Image Descriptions, Text;', 'numpages': '17', 'articleno': '62', 'booktitle': 'Proceedings of the 26th International ACM SIGACCESS Conference on Computers and Accessibility', 'abstract': 'Blind and low vision (BLV) internet users access images on the web via text descriptions. New vision-to-language models such as GPT-V, Gemini, and LLaVa can now provide detailed image descriptions on-demand. While prior research and guidelines state that BLV audiences’ information preferences depend on the context of the image, existing tools for accessing vision-to-language models provide only context-free image descriptions by generating descriptions for the image alone without considering the surrounding webpage context. To explore how to integrate image context into image descriptions, we designed a Chrome Extension that automatically extracts webpage context to inform GPT-4V-generated image descriptions. We gained feedback from 12 BLV participants in a user study comparing typical context-free image descriptions to context-aware image descriptions. We then further evaluated our context-informed image descriptions with a technical evaluation. Our user evaluation demonstrates that BLV participants frequently prefer context-aware descriptions to context-free descriptions. BLV participants also rate context-aware descriptions significantly higher in quality, imaginability, relevance, and plausibility. All participants shared that they wanted to use context-aware descriptions in the future and highlighted the potential for use in online shopping, social media, news, and personal interest blogs.', 'doi': '10.1145/3663548.3675658', 'url': 'https://doi.org/10.1145/3663548.3675658', 'address': 'New York, NY, USA', 'publisher': 'Association for Computing Machinery', 'isbn': '9798400706776', 'year': '2024', 'title': 'Context-Aware Image Descriptions for Web Accessibility', 'author': 'Gubbi Mohanbabu, Ananya and Pavel, Amy', 'ENTRYTYPE': 'inproceedings', 'ID': '10.1145/3663548.3675658'}"
Understanding How Blind Users Handle Object Recognition Errors: Strategies and Challenges,10.1145/3663548.3675635,"Object recognition technologies hold the potential to support blind and low-vision people in navigating the world around them. However, the gap between benchmark performances and practical usability remains a significant challenge. This paper presents a study aimed at understanding blind users’ interaction with object recognition systems for identifying and avoiding errors. Leveraging a pre-existing object recognition system, URCam, fine-tuned for our experiment, we conducted a user study involving 12 blind and low-vision participants. Through in-depth interviews and hands-on error identification tasks, we gained insights into users’ experiences, challenges, and strategies for identifying errors in camera-based assistive technologies and object recognition systems. During interviews, many participants preferred independent error review, while expressing apprehension toward misrecognitions. In the error identification task, participants varied viewpoints, backgrounds, and object sizes in their images to avoid and overcome errors. Even after repeating the task, participants identified only half of the errors, and the proportion of errors identified did not significantly differ from their first attempts. Based on these insights, we offer implications for designing accessible interfaces tailored to the needs of blind and low-vision users in identifying object recognition errors.","{'series': ""ASSETS '24"", 'location': ""St. John's, NL, Canada"", 'keywords': 'blind, camera-based assistive technology, object recognition errors, visual impairment', 'numpages': '15', 'articleno': '63', 'booktitle': 'Proceedings of the 26th International ACM SIGACCESS Conference on Computers and Accessibility', 'abstract': 'Object recognition technologies hold the potential to support blind and low-vision people in navigating the world around them. However, the gap between benchmark performances and practical usability remains a significant challenge. This paper presents a study aimed at understanding blind users’ interaction with object recognition systems for identifying and avoiding errors. Leveraging a pre-existing object recognition system, URCam, fine-tuned for our experiment, we conducted a user study involving 12 blind and low-vision participants. Through in-depth interviews and hands-on error identification tasks, we gained insights into users’ experiences, challenges, and strategies for identifying errors in camera-based assistive technologies and object recognition systems. During interviews, many participants preferred independent error review, while expressing apprehension toward misrecognitions. In the error identification task, participants varied viewpoints, backgrounds, and object sizes in their images to avoid and overcome errors. Even after repeating the task, participants identified only half of the errors, and the proportion of errors identified did not significantly differ from their first attempts. Based on these insights, we offer implications for designing accessible interfaces tailored to the needs of blind and low-vision users in identifying object recognition errors.', 'doi': '10.1145/3663548.3675635', 'url': 'https://doi.org/10.1145/3663548.3675635', 'address': 'New York, NY, USA', 'publisher': 'Association for Computing Machinery', 'isbn': '9798400706776', 'year': '2024', 'title': 'Understanding How Blind Users Handle Object Recognition Errors: Strategies and Challenges', 'author': 'Hong, Jonggi and Kacorri, Hernisa', 'ENTRYTYPE': 'inproceedings', 'ID': '10.1145/3663548.3675635'}"
"""I look at it as the king of knowledge"": How Blind People Use and Understand Generative AI Tools",10.1145/3663548.3675631,"The proliferation of Generative Artificial Intelligence (GenAI) tools has brought a critical shift in how people approach information retrieval and content creation in diverse contexts. Yet, we have limited understanding of how blind people use and make sense of GenAI systems. To bridge this gap, we report findings from interviews with 19 blind individuals who incorporate mainstream GenAI tools like ChatGPT and Be My AI in their everyday practices. Our findings reveal how blind users navigate accessibility issues, inaccuracies, hallucinations, and idiosyncracies associated with GenAI and develop interesting (but often flawed) mental models of how these tools work. We discuss key considerations for rethinking access and information verification in GenAI tools, unpacking erroneous mental models among blind users, and reconciling harms and benefits of GenAI from an accessibility perspective.","{'series': ""ASSETS '24"", 'location': ""St. John's, NL, Canada"", 'keywords': 'Accessibility, ChatGPT, Generative AI, blind, visual impairment', 'numpages': '14', 'articleno': '64', 'booktitle': 'Proceedings of the 26th International ACM SIGACCESS Conference on Computers and Accessibility', 'abstract': 'The proliferation of Generative Artificial Intelligence (GenAI) tools has brought a critical shift in how people approach information retrieval and content creation in diverse contexts. Yet, we have limited understanding of how blind people use and make sense of GenAI systems. To bridge this gap, we report findings from interviews with 19 blind individuals who incorporate mainstream GenAI tools like ChatGPT and Be My AI in their everyday practices. Our findings reveal how blind users navigate accessibility issues, inaccuracies, hallucinations, and idiosyncracies associated with GenAI and develop interesting (but often flawed) mental models of how these tools work. We discuss key considerations for rethinking access and information verification in GenAI tools, unpacking erroneous mental models among blind users, and reconciling harms and benefits of GenAI from an accessibility perspective.', 'doi': '10.1145/3663548.3675631', 'url': 'https://doi.org/10.1145/3663548.3675631', 'address': 'New York, NY, USA', 'publisher': 'Association for Computing Machinery', 'isbn': '9798400706776', 'year': '2024', 'title': '""I look at it as the king of knowledge"": How Blind People Use and Understand Generative AI Tools', 'author': 'Adnin, Rudaiba and Das, Maitraye', 'ENTRYTYPE': 'inproceedings', 'ID': '10.1145/3663548.3675631'}"
EditScribe: Non-Visual Image Editing with Natural Language Verification Loops,10.1145/3663548.3675599,"Image editing is an iterative process that requires precise visual evaluation and manipulation for the output to match the editing intent. However, current image editing tools do not provide accessible interaction nor sufficient feedback for blind and low vision individuals to achieve this level of control. To address this, we developed EditScribe, a prototype system that makes object-level image editing actions accessible using natural language verification loops powered by large multimodal models. Using EditScribe, the user first comprehends the image content through initial general and object descriptions, then specifies edit actions using open-ended natural language prompts. EditScribe performs the image edit, and provides four types of verification feedback for the user to verify the performed edit, including a summary of visual changes, AI judgement, and updated general and object descriptions. The user can ask follow-up questions to clarify and probe into the edits or verification feedback, before performing another edit. In a study with ten blind or low-vision users, we found that EditScribe supported participants to perform and verify image edit actions non-visually. We observed different prompting strategies from participants, and their perceptions on the various types of verification feedback. Finally, we discuss the implications of leveraging natural language verification loops to make visual authoring non-visually accessible.","{'series': ""ASSETS '24"", 'location': ""St. John's, NL, Canada"", 'keywords': 'Accessibility, assistive technology, blind, creativity support tools, generative AI, image editing, low vision, visual authoring', 'numpages': '19', 'articleno': '65', 'booktitle': 'Proceedings of the 26th International ACM SIGACCESS Conference on Computers and Accessibility', 'abstract': 'Image editing is an iterative process that requires precise visual evaluation and manipulation for the output to match the editing intent. However, current image editing tools do not provide accessible interaction nor sufficient feedback for blind and low vision individuals to achieve this level of control. To address this, we developed EditScribe, a prototype system that makes object-level image editing actions accessible using natural language verification loops powered by large multimodal models. Using EditScribe, the user first comprehends the image content through initial general and object descriptions, then specifies edit actions using open-ended natural language prompts. EditScribe performs the image edit, and provides four types of verification feedback for the user to verify the performed edit, including a summary of visual changes, AI judgement, and updated general and object descriptions. The user can ask follow-up questions to clarify and probe into the edits or verification feedback, before performing another edit. In a study with ten blind or low-vision users, we found that EditScribe supported participants to perform and verify image edit actions non-visually. We observed different prompting strategies from participants, and their perceptions on the various types of verification feedback. Finally, we discuss the implications of leveraging natural language verification loops to make visual authoring non-visually accessible.', 'doi': '10.1145/3663548.3675599', 'url': 'https://doi.org/10.1145/3663548.3675599', 'address': 'New York, NY, USA', 'publisher': 'Association for Computing Machinery', 'isbn': '9798400706776', 'year': '2024', 'title': 'EditScribe: Non-Visual Image Editing with Natural Language Verification Loops', 'author': 'Chang, Ruei-Che and Liu, Yuxuan and Zhang, Lotus and Guo, Anhong', 'ENTRYTYPE': 'inproceedings', 'ID': '10.1145/3663548.3675599'}"
Breaking the News Barrier: Towards Understanding News Consumption Practices among BVI Individuals in India,10.1145/3663548.3675608,"Amidst the shift towards digital news media, the news consumption behavior of the blind and visually impaired (BVI) has undergone significant changes. Despite extensive prior work in HCI and Accessibility literature around digital media accessibility for the BVI community – digital news consumption practices among BVI individuals remain inadequately explored. This study focuses on digital news consumption practices among BVI individuals in India. We conducted semi-structured interviews and contextual inquiry with 17 participants, revealing diverse motivations rooted in social mobility and belongingness. Participants disclosed navigational barriers, such as dynamic advertisements, and consequently relied on volunteer-driven ad-free newspapers as a stopgap. While news source preferences were shaped by interface accessibility, factors like neutrality and coverage played a crucial role too. Our findings highlight the need for a nuanced understanding of BVI users’ experiences and inform implications and recommendations for designing accessible digital news platforms.","{'series': ""ASSETS '24"", 'location': ""St. John's, NL, Canada"", 'keywords': 'Accessibility, Blind and Visually Impaired, Information Access, News Consumption, Screen Readers', 'numpages': '11', 'articleno': '66', 'booktitle': 'Proceedings of the 26th International ACM SIGACCESS Conference on Computers and Accessibility', 'abstract': 'Amidst the shift towards digital news media, the news consumption behavior of the blind and visually impaired (BVI) has undergone significant changes. Despite extensive prior work in HCI and Accessibility literature around digital media accessibility for the BVI community – digital news consumption practices among BVI individuals remain inadequately explored. This study focuses on digital news consumption practices among BVI individuals in India. We conducted semi-structured interviews and contextual inquiry with 17 participants, revealing diverse motivations rooted in social mobility and belongingness. Participants disclosed navigational barriers, such as dynamic advertisements, and consequently relied on volunteer-driven ad-free newspapers as a stopgap. While news source preferences were shaped by interface accessibility, factors like neutrality and coverage played a crucial role too. Our findings highlight the need for a nuanced understanding of BVI users’ experiences and inform implications and recommendations for designing accessible digital news platforms.', 'doi': '10.1145/3663548.3675608', 'url': 'https://doi.org/10.1145/3663548.3675608', 'address': 'New York, NY, USA', 'publisher': 'Association for Computing Machinery', 'isbn': '9798400706776', 'year': '2024', 'title': 'Breaking the News Barrier: Towards Understanding News Consumption Practices among BVI Individuals in India', 'author': 'Mowar, Peya and Gupta, Meghna and Jain, Mohit', 'ENTRYTYPE': 'inproceedings', 'ID': '10.1145/3663548.3675608'}"
“Not Only Annoying but Dangerous”: devising an ecology of protections for photosensitive social media users,10.1145/3663548.3675610,"Photosensitivity among social media and internet users is an underappreciated risk factor for real physiological harm which can be actively or passively caused by designer and developer choices. Flashing graphics caused by GIFs, video, or even interface animations can trigger nausea, dizziness, migraines, and even seizures. Although there are some guidelines for protections for photosensitive users in W3C's WCAG, these guidelines are often not met by developers, and are insufficient for robust user protection. In this multi-pronged exploratory research project, we work with photosensitive users, design students, and graphics experts to imagine a complete ecosystem of protections which layer vulnerable users at the community, platform, system, and hardware levels. In this paper, we argue for the urgency of reforms in device and internet infrastructure, development practices, design norms, and community behaviors. We then propose an ecosystem of protections which more holistically shield photosensitive users from ambient, accidental, and malicious exposure to flashing graphics.","{'series': ""ASSETS '24"", 'location': ""St. John's, NL, Canada"", 'numpages': '14', 'articleno': '67', 'booktitle': 'Proceedings of the 26th International ACM SIGACCESS Conference on Computers and Accessibility', 'abstract': ""Photosensitivity among social media and internet users is an underappreciated risk factor for real physiological harm which can be actively or passively caused by designer and developer choices. Flashing graphics caused by GIFs, video, or even interface animations can trigger nausea, dizziness, migraines, and even seizures. Although there are some guidelines for protections for photosensitive users in W3C's WCAG, these guidelines are often not met by developers, and are insufficient for robust user protection. In this multi-pronged exploratory research project, we work with photosensitive users, design students, and graphics experts to imagine a complete ecosystem of protections which layer vulnerable users at the community, platform, system, and hardware levels. In this paper, we argue for the urgency of reforms in device and internet infrastructure, development practices, design norms, and community behaviors. We then propose an ecosystem of protections which more holistically shield photosensitive users from ambient, accidental, and malicious exposure to flashing graphics."", 'doi': '10.1145/3663548.3675610', 'url': 'https://doi.org/10.1145/3663548.3675610', 'address': 'New York, NY, USA', 'publisher': 'Association for Computing Machinery', 'isbn': '9798400706776', 'year': '2024', 'title': '“Not Only Annoying but Dangerous”: devising an ecology of protections for photosensitive social media users', 'author': 'Williams, Rua Mae and Park, Chorong and Dodhy, Laila Sameer and Pal, Monaami and Dnyanmote, Atharva Anand and Lam, Luchcha Angel and Joo, Sean', 'ENTRYTYPE': 'inproceedings', 'ID': '10.1145/3663548.3675610'}"
