Title,DOI,Abstract,BibTeX
Accessibility through Awareness of Noise Sensitivity Management and Regulation Practices,10.1145/3663548.3675630,"Noise sensitivity results in a range of experiences, from small annoyances to extreme pain in response to sound. While anyone can experience it, many neurodivergent people report this sensory processing challenge. Novel technologies can help people with noise sensitivity (PWNS) manage their sensitivities. We conducted an interview study with 21 PWNS and 9 caregivers over three months to understand their management and regulation practices and opportunities for technology-mediated support. We found that awareness is a salient factor that influences both management and regulation practices. Based on their awareness, people primarily use avoidance and sound masking approaches or engage in personal coping strategies such as journaling, setting boundaries, and alerting others to regulate. We build on prior research on interdependence, mutual care, and collaborative work to situate the concept of joint awareness to foster collaborative management and regulation for noise sensitivity. Then, we discuss the role of awareness in noise sensitivity management and regulation and provide design principles for the creation of future technology to support noise sensitivity awareness, management, and regulation.","{'series': ""ASSETS '24"", 'location': ""St. John's, NL, Canada"", 'keywords': 'Assistive Technology, Awareness, Collaborative Management, Interdependence, Noise Sensitivity, Self-Regulation', 'numpages': '12', 'articleno': '32', 'booktitle': 'Proceedings of the 26th International ACM SIGACCESS Conference on Computers and Accessibility', 'abstract': 'Noise sensitivity results in a range of experiences, from small annoyances to extreme pain in response to sound. While anyone can experience it, many neurodivergent people report this sensory processing challenge. Novel technologies can help people with noise sensitivity (PWNS) manage their sensitivities. We conducted an interview study with 21 PWNS and 9 caregivers over three months to understand their management and regulation practices and opportunities for technology-mediated support. We found that awareness is a salient factor that influences both management and regulation practices. Based on their awareness, people primarily use avoidance and sound masking approaches or engage in personal coping strategies such as journaling, setting boundaries, and alerting others to regulate. We build on prior research on interdependence, mutual care, and collaborative work to situate the concept of joint awareness to foster collaborative management and regulation for noise sensitivity. Then, we discuss the role of awareness in noise sensitivity management and regulation and provide design principles for the creation of future technology to support noise sensitivity awareness, management, and regulation.', 'doi': '10.1145/3663548.3675630', 'url': 'https://doi.org/10.1145/3663548.3675630', 'address': 'New York, NY, USA', 'publisher': 'Association for Computing Machinery', 'isbn': '9798400706776', 'year': '2024', 'title': 'Accessibility through Awareness of Noise Sensitivity Management and Regulation Practices', 'author': 'Dotch, Emani and Mavrovounioti, Avery and Du, Weijie and Ankrah, Elizabeth and Johnson, Jazette and Min, Aehong and Hayes, Gillian R', 'ENTRYTYPE': 'inproceedings', 'ID': '10.1145/3663548.3675630'}"
MaskSound: Exploring Sound Masking Approaches to Support People with Autism in Managing Noise Sensitivity,10.1145/3663548.3675656,"Noise sensitivity is a frequently reported characteristic in many autistic individuals. While strategies like sound isolation (e.g., noise-canceling headphones) and avoidance behaviors (e.g., leaving a crowded room) can help, they can reduce situational awareness and limit social engagement. In this paper, we examine an alternate approach to managing noise sensitivity: introducing ambient background sounds to reduce the perception of disruptive noises, i.e., sound masking. Through two studies (with ten and nine autistic individuals respectively), we investigated the autistic individuals’ preferred sound masks (e.g., white noise, brown noise, calming water sounds) for different contexts (e.g., traffic, speech) and elicited reactions for a future interactive tool to deliver effective sound masks. Our findings have implications not just for the accessibility community, but also for designers and researchers working on sound augmentation technology.","{'series': ""ASSETS '24"", 'location': ""St. John's, NL, Canada"", 'numpages': '12', 'articleno': '33', 'booktitle': 'Proceedings of the 26th International ACM SIGACCESS Conference on Computers and Accessibility', 'abstract': 'Noise sensitivity is a frequently reported characteristic in many autistic individuals. While strategies like sound isolation (e.g., noise-canceling headphones) and avoidance behaviors (e.g., leaving a crowded room) can help, they can reduce situational awareness and limit social engagement. In this paper, we examine an alternate approach to managing noise sensitivity: introducing ambient background sounds to reduce the perception of disruptive noises, i.e., sound masking. Through two studies (with ten and nine autistic individuals respectively), we investigated the autistic individuals’ preferred sound masks (e.g., white noise, brown noise, calming water sounds) for different contexts (e.g., traffic, speech) and elicited reactions for a future interactive tool to deliver effective sound masks. Our findings have implications not just for the accessibility community, but also for designers and researchers working on sound augmentation technology.', 'doi': '10.1145/3663548.3675656', 'url': 'https://doi.org/10.1145/3663548.3675656', 'address': 'New York, NY, USA', 'publisher': 'Association for Computing Machinery', 'isbn': '9798400706776', 'year': '2024', 'title': 'MaskSound: Exploring Sound Masking Approaches to Support People with Autism in Managing Noise Sensitivity', 'author': 'Park, Anna Y and Jin, Andy and Huang, Jeremy Zhengqi and Carr, Jesse and Jain, Dhruv', 'ENTRYTYPE': 'inproceedings', 'ID': '10.1145/3663548.3675656'}"
SoundModVR: Sound Modifications in Virtual Reality to Support People who are Deaf and Hard of Hearing,10.1145/3663548.3675653,"Previous VR sound accessibility work substituted sounds with visual or haptic output to increase VR accessibility for deaf and hard of hearing (DHH) people. However, deafness occurs on a spectrum, and many DHH people (e.g., those with partial hearing) can also benefit greatly from having more control over the audio instead of substituting it with another modality. In this paper, we explore the possibilities of modifying sounds in VR to support DHH people. To understand the best modification features for this goal, we designed and implemented 18 VR sound modification tools spanning four categories, including prioritizing sounds, modifying sound parameters, providing spatial assistance, and adding additional sounds. We evaluated our tools in five diverse VR scenarios with 10 DHH people, finding that our tool can improve DHH users’ VR experience, but could be further improved by providing more customization options and decreasing distraction. We then compiled a Unity toolkit from select tools and conducted a preliminary evaluation with six Unity VR developers. Findings show that our toolkit is easy to use and debug but could be enhanced through modularization and better documentation. We close by discussing further implications of sound modification in VR.","{'series': ""ASSETS '24"", 'location': ""St. John's, NL, Canada"", 'numpages': '15', 'articleno': '34', 'booktitle': 'Proceedings of the 26th International ACM SIGACCESS Conference on Computers and Accessibility', 'abstract': 'Previous VR sound accessibility work substituted sounds with visual or haptic output to increase VR accessibility for deaf and hard of hearing (DHH) people. However, deafness occurs on a spectrum, and many DHH people (e.g., those with partial hearing) can also benefit greatly from having more control over the audio instead of substituting it with another modality. In this paper, we explore the possibilities of modifying sounds in VR to support DHH people. To understand the best modification features for this goal, we designed and implemented 18 VR sound modification tools spanning four categories, including prioritizing sounds, modifying sound parameters, providing spatial assistance, and adding additional sounds. We evaluated our tools in five diverse VR scenarios with 10 DHH people, finding that our tool can improve DHH users’ VR experience, but could be further improved by providing more customization options and decreasing distraction. We then compiled a Unity toolkit from select tools and conducted a preliminary evaluation with six Unity VR developers. Findings show that our toolkit is easy to use and debug but could be enhanced through modularization and better documentation. We close by discussing further implications of sound modification in VR.', 'doi': '10.1145/3663548.3675653', 'url': 'https://doi.org/10.1145/3663548.3675653', 'address': 'New York, NY, USA', 'publisher': 'Association for Computing Machinery', 'isbn': '9798400706776', 'year': '2024', 'title': 'SoundModVR: Sound Modifications in Virtual Reality to Support People who are Deaf and Hard of Hearing', 'author': 'Cao, Xinyun and Jain, Dhruv', 'ENTRYTYPE': 'inproceedings', 'ID': '10.1145/3663548.3675653'}"
"""Seven Stitches Later"": A Technologically Interdependent Travel Experience From The Perspective Of A Visually Impaired Individual",10.1145/3663548.3688544,"Travel is an integral aspect of our lives, and this rings true for blind and visually impaired individuals alike. This activity can be enhanced with technology to facilitate a safer and more efficient experience, however with the abundance of options available it becomes difficult to establish a decision on which tools to use. In this autoethnography, I propose a technologically interdependent travel framework comprised of five pillars, orientation, communication, evaluation, navigation, and transportation. Based on over ten years of technology-supported travel experiences I have encountered first-hand as a visually impaired traveler, this experience report serves as a demonstration of what tools I have chosen and why, as well as how I utilize them throughout a naturalistic travel experience while associating each tool to a pillar from the proposed framework. I conclude this report with a recognition of existing limitations and opportunities for future research based on my observations and experiences.","{'series': ""ASSETS '24"", 'location': ""St. John's, NL, Canada"", 'keywords': 'Interdependent, Mobility, Navigation, Orientation, Technology, Transportation, Travel', 'numpages': '6', 'articleno': '35', 'booktitle': 'Proceedings of the 26th International ACM SIGACCESS Conference on Computers and Accessibility', 'abstract': 'Travel is an integral aspect of our lives, and this rings true for blind and visually impaired individuals alike. This activity can be enhanced with technology to facilitate a safer and more efficient experience, however with the abundance of options available it becomes difficult to establish a decision on which tools to use. In this autoethnography, I propose a technologically interdependent travel framework comprised of five pillars, orientation, communication, evaluation, navigation, and transportation. Based on over ten years of technology-supported travel experiences I have encountered first-hand as a visually impaired traveler, this experience report serves as a demonstration of what tools I have chosen and why, as well as how I utilize them throughout a naturalistic travel experience while associating each tool to a pillar from the proposed framework. I conclude this report with a recognition of existing limitations and opportunities for future research based on my observations and experiences.', 'doi': '10.1145/3663548.3688544', 'url': 'https://doi.org/10.1145/3663548.3688544', 'address': 'New York, NY, USA', 'publisher': 'Association for Computing Machinery', 'isbn': '9798400706776', 'year': '2024', 'title': '""Seven Stitches Later"": A Technologically Interdependent Travel Experience From The Perspective Of A Visually Impaired Individual', 'author': 'Zeidieh, Aziz N', 'ENTRYTYPE': 'inproceedings', 'ID': '10.1145/3663548.3688544'}"
Uncovering the New Accessibility Crisis in Scholarly PDFs: Publishing Model and Platform Changes Contribute to Declining Scholarly Document Accessibility in the Last Decade,10.1145/3663548.3675634,"Most scholarly works are distributed online in PDF format, which can present significant accessibility challenges for blind and low-vision readers. To characterize the scope of this issue, we perform a large-scale analysis of 20K open- and closed-access scholarly PDFs published between 2014–2023 sampled across broad fields of study. We assess the accessibility compliance of these documents based on six criteria: Default Language, Appropriate Nesting, Tagged PDF, Table Headers, Tab Order, and Alt-Text; selected based on prior work and the SIGACCESS Guide for Accessible PDFs [34]. To ensure robustness, we corroborate our findings through automated accessibility checking, manual evaluation of alt text, comparative assessments with an alternate accessibility checker, and manual assessments with screen readers. Our findings reveal that less than 3.2\% of tested PDFs satisfy all criteria, while a large majority (74.9\%) fail to meet any criteria at all. Worse yet, we observe a concerning drop in PDF accessibility since 2019, largely among open access papers, suggesting that efforts to improve document accessibility have not taken hold and are on a backslide. While investigating factors contributing to this drop, we identify key associations between fields of study, creation platforms used, models of publishing, and PDF accessibility compliance, suggesting that publisher and author choices significantly influence document accessibility. This paper highlights a new crisis in scholarly document accessibility and the need for a multi-faceted approach to address the problem, involving the development of better tools, enhanced author education, and systemic changes in academic publishing practices.","{'series': ""ASSETS '24"", 'location': ""St. John's, NL, Canada"", 'numpages': '16', 'articleno': '36', 'booktitle': 'Proceedings of the 26th International ACM SIGACCESS Conference on Computers and Accessibility', 'abstract': 'Most scholarly works are distributed online in PDF format, which can present significant accessibility challenges for blind and low-vision readers. To characterize the scope of this issue, we perform a large-scale analysis of 20K open- and closed-access scholarly PDFs published between 2014–2023 sampled across broad fields of study. We assess the accessibility compliance of these documents based on six criteria: Default Language, Appropriate Nesting, Tagged PDF, Table Headers, Tab Order, and Alt-Text; selected based on prior work and the SIGACCESS Guide for Accessible PDFs [34]. To ensure robustness, we corroborate our findings through automated accessibility checking, manual evaluation of alt text, comparative assessments with an alternate accessibility checker, and manual assessments with screen readers. Our findings reveal that less than 3.2\\% of tested PDFs satisfy all criteria, while a large majority (74.9\\%) fail to meet any criteria at all. Worse yet, we observe a concerning drop in PDF accessibility since 2019, largely among open access papers, suggesting that efforts to improve document accessibility have not taken hold and are on a backslide. While investigating factors contributing to this drop, we identify key associations between fields of study, creation platforms used, models of publishing, and PDF accessibility compliance, suggesting that publisher and author choices significantly influence document accessibility. This paper highlights a new crisis in scholarly document accessibility and the need for a multi-faceted approach to address the problem, involving the development of better tools, enhanced author education, and systemic changes in academic publishing practices.', 'doi': '10.1145/3663548.3675634', 'url': 'https://doi.org/10.1145/3663548.3675634', 'address': 'New York, NY, USA', 'publisher': 'Association for Computing Machinery', 'isbn': '9798400706776', 'year': '2024', 'title': 'Uncovering the New Accessibility Crisis in Scholarly PDFs: Publishing Model and Platform Changes Contribute to Declining Scholarly Document Accessibility in the Last Decade', 'author': 'Kumar, Anukriti and Wang, Lucy Lu', 'ENTRYTYPE': 'inproceedings', 'ID': '10.1145/3663548.3675634'}"
SMART-TBI: Design and Evaluation of the Social Media Accessibility and Rehabilitation Toolkit for Users with Traumatic Brain Injury,10.1145/3663548.3675641,"Traumatic brain injury (TBI) can cause a range of cognitive and communication challenges that negatively affect social participation in both face-to-face interactions and computer-mediated communication. In particular, individuals with TBI report barriers that limit access to participation on social media platforms. To improve access to and use of social media for users with TBI, we introduce the Social Media Accessibility and Rehabilitation Toolkit (SMART-TBI). The toolkit includes five aids (Writing Aid, Interpretation Aid, Filter Mode, Focus Mode, and Facebook Customization) designed to address the cognitive and communicative needs of individuals with TBI. We asked eight users with moderate-severe TBI and five TBI rehabilitation experts to evaluate each aid. Our findings revealed potential benefits of aids and areas for improvement, including the need for psychological safety, privacy control, and balancing business and accessibility needs; and overall mixed reactions among the participants to AI-based aids.","{'series': ""ASSETS '24"", 'location': ""St. John's, NL, Canada"", 'keywords': 'Accessibility, Facebook, Social Media, Traumatic Brain Injury (TBI)', 'numpages': '19', 'articleno': '37', 'booktitle': 'Proceedings of the 26th International ACM SIGACCESS Conference on Computers and Accessibility', 'abstract': 'Traumatic brain injury (TBI) can cause a range of cognitive and communication challenges that negatively affect social participation in both face-to-face interactions and computer-mediated communication. In particular, individuals with TBI report barriers that limit access to participation on social media platforms. To improve access to and use of social media for users with TBI, we introduce the Social Media Accessibility and Rehabilitation Toolkit (SMART-TBI). The toolkit includes five aids (Writing Aid, Interpretation Aid, Filter Mode, Focus Mode, and Facebook Customization) designed to address the cognitive and communicative needs of individuals with TBI. We asked eight users with moderate-severe TBI and five TBI rehabilitation experts to evaluate each aid. Our findings revealed potential benefits of aids and areas for improvement, including the need for psychological safety, privacy control, and balancing business and accessibility needs; and overall mixed reactions among the participants to AI-based aids.', 'doi': '10.1145/3663548.3675641', 'url': 'https://doi.org/10.1145/3663548.3675641', 'address': 'New York, NY, USA', 'publisher': 'Association for Computing Machinery', 'isbn': '9798400706776', 'year': '2024', 'title': 'SMART-TBI: Design and Evaluation of the Social Media Accessibility and Rehabilitation Toolkit for Users with Traumatic Brain Injury', 'author': 'Hu, Yaxin and Lim, Hajin and Kakonge, Lisa and Mitchell, Jade T. and Johnson, Hailey L. and Turkstra, Lyn S. and Duff, Melissa C. and Toma, Catalina L. and Mutlu, Bilge', 'ENTRYTYPE': 'inproceedings', 'ID': '10.1145/3663548.3675641'}"
The Promise and Pitfalls of Web Accessibility Overlays for Blind and Low Vision Users,10.1145/3663548.3675650,"Web accessibility is essential for ensuring that all individuals, regardless of their physical or cognitive abilities, can access and effectively use the internet. This principle is fundamental as digital platforms increasingly become primary channels for education, communication, commerce, and entertainment. Our study critically evaluates the effectiveness of accessibility overlays, which are third-party tools that claim to enhance website usability for people with disabilities. Specifically, we focused on the experiences of blind and low-vision users, who are disproportionately impacted by poor web accessibility. Through a combination of online surveys and interviews, we engaged with participants who employ a variety of assistive technologies to navigate the web. The empirical evidence gathered paints a troubling picture: despite their intended purpose, accessibility overlays often fail to deliver on their promises and, in many cases, increase existing challenges. Participants frequently reported that these overlays conflicted with their assistive technologies, leading to reduced functionality and increased frustration. This points to a significant misalignment between the design of these tools and the real-world needs of users. The study highlights the pressing need to move away from superficial technological fixes and towards deeper, more meaningful engagement with the needs of disabled users. This involves embracing user-centered design practices that integrate accessibility considerations from the ground up, ensuring that digital environments are truly inclusive. By prioritizing comprehensive, well-integrated solutions over patches like overlays, we can foster a more accessible and equitable digital landscape.","{'series': ""ASSETS '24"", 'location': ""St. John's, NL, Canada"", 'keywords': 'Accessibility overlays, web accessibility', 'numpages': '12', 'articleno': '38', 'booktitle': 'Proceedings of the 26th International ACM SIGACCESS Conference on Computers and Accessibility', 'abstract': 'Web accessibility is essential for ensuring that all individuals, regardless of their physical or cognitive abilities, can access and effectively use the internet. This principle is fundamental as digital platforms increasingly become primary channels for education, communication, commerce, and entertainment. Our study critically evaluates the effectiveness of accessibility overlays, which are third-party tools that claim to enhance website usability for people with disabilities. Specifically, we focused on the experiences of blind and low-vision users, who are disproportionately impacted by poor web accessibility. Through a combination of online surveys and interviews, we engaged with participants who employ a variety of assistive technologies to navigate the web. The empirical evidence gathered paints a troubling picture: despite their intended purpose, accessibility overlays often fail to deliver on their promises and, in many cases, increase existing challenges. Participants frequently reported that these overlays conflicted with their assistive technologies, leading to reduced functionality and increased frustration. This points to a significant misalignment between the design of these tools and the real-world needs of users. The study highlights the pressing need to move away from superficial technological fixes and towards deeper, more meaningful engagement with the needs of disabled users. This involves embracing user-centered design practices that integrate accessibility considerations from the ground up, ensuring that digital environments are truly inclusive. By prioritizing comprehensive, well-integrated solutions over patches like overlays, we can foster a more accessible and equitable digital landscape.', 'doi': '10.1145/3663548.3675650', 'url': 'https://doi.org/10.1145/3663548.3675650', 'address': 'New York, NY, USA', 'publisher': 'Association for Computing Machinery', 'isbn': '9798400706776', 'year': '2024', 'title': 'The Promise and Pitfalls of Web Accessibility Overlays for Blind and Low Vision Users', 'author': 'Makati, Tlamelo and Tigwell, Garreth W. and Shinohara, Kristen', 'ENTRYTYPE': 'inproceedings', 'ID': '10.1145/3663548.3675650'}"
